{
  "$schema": "https://json-schema.org/draft/2020-12/schema",
  "$id": "https://palimpsest.info/protocol/event-analysis-v1.schema.json",
  "title": "Palimpsest per-event analysis v1",
  "description": "A deterministic assessment of one newswire event using source structure and explicitly declared collector context without treating topical links as verification.",
  "type": "object",
  "additionalProperties": false,
  "required": [
    "schema_version",
    "analysis_id",
    "event_id",
    "event_version_id",
    "event_url",
    "url",
    "generated_at",
    "disposition",
    "scope_status",
    "position",
    "rationale",
    "evidence_assessment",
    "collector_context",
    "limitations",
    "method"
  ],
  "properties": {
    "schema_version": {"const": "palimpsest-event-analysis.v1"},
    "analysis_id": {
      "type": "string",
      "pattern": "^analysisv-[0-9a-f]{24}$"
    },
    "event_id": {"$ref": "#/$defs/eventId"},
    "event_version_id": {"$ref": "#/$defs/eventVersionId"},
    "event_url": {
      "type": "string",
      "pattern": "^https://palimpsest\\.info/news/wire/event-[0-9a-f]{24}/$"
    },
    "url": {
      "type": "string",
      "pattern": "^https://palimpsest\\.info/news/wire/event-[0-9a-f]{24}/analysis\\.json$"
    },
    "generated_at": {"$ref": "#/$defs/timestamp"},
    "disposition": {
      "enum": [
        "outside-remit",
        "source-assessment",
        "collector-context",
        "collector-abstention"
      ]
    },
    "scope_status": {"enum": ["in-scope", "outside-remit"]},
    "position": {"$ref": "#/$defs/longText"},
    "rationale": {
      "type": "array",
      "minItems": 1,
      "maxItems": 6,
      "items": {"$ref": "#/$defs/longText"}
    },
    "evidence_assessment": {"$ref": "#/$defs/evidenceAssessment"},
    "collector_context": {
      "type": "array",
      "maxItems": 32,
      "items": {"$ref": "#/$defs/collectorContext"}
    },
    "limitations": {
      "type": "array",
      "minItems": 1,
      "maxItems": 8,
      "uniqueItems": true,
      "items": {"$ref": "#/$defs/longText"}
    },
    "method": {"$ref": "#/$defs/longText"}
  },
  "$defs": {
    "eventId": {
      "type": "string",
      "pattern": "^event-[0-9a-f]{24}$"
    },
    "eventVersionId": {
      "type": "string",
      "pattern": "^eventv-[0-9a-f]{24}$"
    },
    "identifier": {
      "type": "string",
      "pattern": "^[a-z][a-z0-9-]{0,79}$"
    },
    "sha256": {
      "type": "string",
      "pattern": "^[0-9a-f]{64}$"
    },
    "timestamp": {
      "type": "string",
      "format": "date-time",
      "pattern": "^\\d{4}-\\d{2}-\\d{2}T\\d{2}:\\d{2}:\\d{2}Z$"
    },
    "longText": {
      "type": "string",
      "minLength": 1,
      "maxLength": 8192,
      "pattern": "^[^\\u0000-\\u001f\\u007f-\\u009f\\u200e\\u200f\\u202a-\\u202e\\u2066-\\u2069]*$"
    },
    "nullableLabel": {
      "oneOf": [
        {
          "type": "string",
          "minLength": 1,
          "maxLength": 100,
          "pattern": "^[^\\u0000-\\u001f\\u007f-\\u009f\\u200e\\u200f\\u202a-\\u202e\\u2066-\\u2069]*$"
        },
        {"type": "null"}
      ]
    },
    "evidenceStrength": {
      "enum": [
        "measurement-corroborated",
        "primary-corroborated",
        "multi-source",
        "single-measurement-source",
        "single-primary-source",
        "single-source"
      ]
    },
    "evidenceAssessment": {
      "type": "object",
      "additionalProperties": false,
      "required": [
        "strength",
        "independent_groups",
        "source_count",
        "conclusion"
      ],
      "properties": {
        "strength": {"$ref": "#/$defs/evidenceStrength"},
        "independent_groups": {
          "type": "integer",
          "minimum": 1,
          "maximum": 16
        },
        "source_count": {
          "type": "integer",
          "minimum": 1,
          "maximum": 4096
        },
        "conclusion": {"$ref": "#/$defs/longText"}
      }
    },
    "denominator": {
      "type": "object",
      "additionalProperties": false,
      "required": ["label", "value"],
      "properties": {
        "label": {"$ref": "#/$defs/nullableLabel"},
        "value": {
          "oneOf": [{"type": "number"}, {"type": "null"}]
        }
      }
    },
    "metric": {
      "type": "object",
      "additionalProperties": false,
      "required": ["label", "value", "unit", "denominator"],
      "properties": {
        "label": {"$ref": "#/$defs/nullableLabel"},
        "value": {
          "oneOf": [{"type": "number"}, {"type": "null"}]
        },
        "unit": {"$ref": "#/$defs/nullableLabel"},
        "denominator": {"$ref": "#/$defs/denominator"}
      }
    },
    "collectorContext": {
      "type": "object",
      "additionalProperties": false,
      "required": [
        "signal_id",
        "status",
        "headline",
        "finding",
        "metric",
        "source_timestamp",
        "story_url",
        "evidence_url",
        "input_sha256",
        "claim_fingerprint",
        "method_summary",
        "method_version",
        "relation",
        "interpretation"
      ],
      "properties": {
        "signal_id": {"$ref": "#/$defs/identifier"},
        "status": {
          "enum": ["live", "degraded", "stale", "missing", "corrupt"]
        },
        "headline": {"$ref": "#/$defs/longText"},
        "finding": {"$ref": "#/$defs/longText"},
        "metric": {"$ref": "#/$defs/metric"},
        "source_timestamp": {
          "oneOf": [{"$ref": "#/$defs/timestamp"}, {"type": "null"}]
        },
        "story_url": {
          "type": "string",
          "pattern": "^https://palimpsest\\.info/news/[a-z0-9]+(?:-[a-z0-9]+)*/$"
        },
        "evidence_url": {
          "type": "string",
          "pattern": "^https://palimpsest\\.info/readings/[a-z0-9][a-z0-9.-]{0,126}\\.json$"
        },
        "input_sha256": {
          "oneOf": [{"$ref": "#/$defs/sha256"}, {"type": "null"}]
        },
        "claim_fingerprint": {
          "type": "string",
          "pattern": "^sha256:[0-9a-f]{64}$"
        },
        "method_summary": {"$ref": "#/$defs/longText"},
        "method_version": {
          "oneOf": [
            {"type": "integer", "minimum": 1},
            {"type": "string", "minLength": 1, "maxLength": 100},
            {"type": "null"}
          ]
        },
        "relation": {"const": "topic-surface-only"},
        "interpretation": {"$ref": "#/$defs/longText"}
      }
    }
  }
}
