{
  "schema_version": "palimpsest-event-analysis.v1",
  "analysis_id": "analysisv-a00b938f80171d972f803b53",
  "event_id": "event-581600c23011df7f454134b8",
  "event_version_id": "eventv-1a04a2c13070d3af5fd93461",
  "event_url": "https://palimpsest.info/news/wire/event-581600c23011df7f454134b8/",
  "url": "https://palimpsest.info/news/wire/event-581600c23011df7f454134b8/analysis.json",
  "generated_at": "2026-08-15T20:11:32Z",
  "disposition": "outside-remit",
  "scope_status": "outside-remit",
  "position": "Palimpsest's view: this item falls outside the declared China evidence remit and should not be read as a Palimpsest finding.",
  "rationale": [
    "The dossier contains one independent source group. Palimpsest treats it as an attributed report, not independent corroboration.",
    "Neither an intrinsically China-scoped source, an explicit China term, nor an intake-approved collector link places this item inside the declared remit."
  ],
  "evidence_assessment": {
    "strength": "single-source",
    "independent_groups": 1,
    "source_count": 1,
    "conclusion": "The dossier contains one independent source group. Palimpsest treats it as an attributed report, not independent corroboration."
  },
  "collector_context": [],
  "limitations": [
    "Palimpsest retained feed title, canonical link, publication time, and a bounded excerpt; it did not fetch or semantically evaluate the article body.",
    "Independent-source counts describe publication structure, not the truth, completeness, or intent of the underlying claims.",
    "No current Palimpsest measurement is used in this assessment."
  ],
  "method": "Deterministic assessment of one validated newswire event against its independent-source structure and only the collector stories explicitly declared by that event. Collector joins remain topic-surface-only: no article body is fetched, no generative model is used, and no current measurement is represented as article-specific verification or causation."
}
