{
  "schema_version": "palimpsest-event-analysis.v1",
  "analysis_id": "analysisv-df9bdca51b1d426d9d3d4cbc",
  "event_id": "event-0ed7e7098bb71ab17365a86b",
  "event_version_id": "eventv-daa2b9fa0a25ad9927bb7eb3",
  "event_url": "https://palimpsest.info/news/wire/event-0ed7e7098bb71ab17365a86b/",
  "url": "https://palimpsest.info/news/wire/event-0ed7e7098bb71ab17365a86b/analysis.json",
  "generated_at": "2026-08-15T10:27:05Z",
  "disposition": "collector-abstention",
  "scope_status": "in-scope",
  "position": "Palimpsest withholds a collector-backed conclusion because one or more declared measurement surfaces are not current.",
  "rationale": [
    "The dossier contains one independent source group. Palimpsest treats it as an attributed report, not independent corroboration.",
    "1 of 4 declared collector surfaces are not live, so Palimpsest does not issue a collector-backed view."
  ],
  "evidence_assessment": {
    "strength": "single-primary-source",
    "independent_groups": 1,
    "source_count": 1,
    "conclusion": "The dossier contains one independent source group. Palimpsest treats it as an attributed report, not independent corroboration."
  },
  "collector_context": [
    {
      "signal_id": "china-econ",
      "status": "live",
      "headline": "3 official money-market benchmark families are reporting",
      "finding": "The current CFETS reading contains 3 reporting benchmark families.",
      "metric": {
        "label": "benchmark families reporting",
        "value": 3,
        "unit": "count",
        "denominator": {
          "label": null,
          "value": null
        }
      },
      "source_timestamp": "2026-08-15T10:27:05Z",
      "story_url": "https://palimpsest.info/news/china-money-market-benchmarks/",
      "evidence_url": "https://palimpsest.info/readings/china-econ-latest.json",
      "input_sha256": "55b5e6ab98584216c521857067e0d66e56add8e2b7747ccf2840a67aa8202a47",
      "claim_fingerprint": "sha256:ec0f881c4f5909c7ce1b1422ed24fed5ce90df6f28e8cbff1c7c66cab5ba5743",
      "method_summary": "See the complete embedded upstream payload and its raw feed",
      "method_version": 3,
      "relation": "topic-surface-only",
      "interpretation": "Current aggregate collector reading. It is relevant context only; the wire declares no timed, claim-specific verification join."
    },
    {
      "signal_id": "cny-fix-gap",
      "status": "live",
      "headline": "The official yuan fix gap is -0.6846% against the independent reference",
      "finding": "The current official-fix minus independent-reference gap is -0.6846%.",
      "metric": {
        "label": "fix gap",
        "value": -0.6846,
        "unit": "percent",
        "denominator": {
          "label": null,
          "value": null
        }
      },
      "source_timestamp": "2026-08-14T17:51:31Z",
      "story_url": "https://palimpsest.info/news/cny-fix-gap/",
      "evidence_url": "https://palimpsest.info/readings/cny-fix-gap-latest.json",
      "input_sha256": "25cb6fa1c979711590c1f4a03c2862531e443da0184156f0310907d4079e4021",
      "claim_fingerprint": "sha256:4b7244e10cdf17a59b1d8f98170dfacde6845b5383ebc4a5ddf5e1f3e6a950cf",
      "method_summary": "two prices for one currency: the state's 09:15 Beijing fix vs an independent same-day market reference (ECB concertation, 14:15 CET = 20:15 Beijing). gap_pct > 0 means the market prices the yuan weaker than the fix; the band is ±2%, so gap_pct is read against that scale. Computed only on days a fix exists — ECB prints CNY on Chinese holidays and a gap against an unset fix would be fiction. Onshore only: no licence-clean keyless CNH source exists (the TMA fixing is licensed), stated rather than worked around. cross_check_diff is the ECB-vs-BoC derivation disagreement, published so a silent break in either source is visible; it is null on rounds where the Bank of Canada leg did not answer. Economic backdrop, not censorship — deliberately off the alarm board",
      "method_version": 1,
      "relation": "topic-surface-only",
      "interpretation": "Current aggregate collector reading. It is relevant context only; the wire declares no timed, claim-specific verification join."
    },
    {
      "signal_id": "data-darkness",
      "status": "stale",
      "headline": "Official-data darkness: no current finding",
      "finding": "No current finding is published for Official-data darkness because the source status is stale.",
      "metric": {
        "label": null,
        "value": null,
        "unit": null,
        "denominator": {
          "label": null,
          "value": null
        }
      },
      "source_timestamp": "2026-08-13T11:06:11Z",
      "story_url": "https://palimpsest.info/news/official-data-darkness/",
      "evidence_url": "https://palimpsest.info/readings/data-darkness-latest.json",
      "input_sha256": "55518ec26c2c20faade1091f09c2c45b168cc43cb7ae755f7e2ff89b06ef896c",
      "claim_fingerprint": "sha256:0b041b3529018c1ffc1dc78c1516d4244abbe9831be11cc783f6a7111f3bc7a6",
      "method_summary": "publication-cadence watch: each surface reports the latest release visible from this vantage, scored as days-since against its own nominal cadence (business-day basis for daily series, so weekends are not darkness; Chinese public holidays are not modelled and appear as short recurring spikes the detector's reference learns). NBS series additionally carry days_past_promise, scored against the state's own published release calendar — a promise date is sharper than a learned rhythm. darkness_index is the mean staleness ratio over surfaces that answered. A surface that could not be fetched is listed as unreachable and excluded — vantage trouble is not withholding (nra.gov.cn in particular is known to gate some foreign vantages). A high index states that official surfaces are late against their own rhythm; it does not establish intent",
      "method_version": 1,
      "relation": "topic-surface-only",
      "interpretation": "Collector status is stale; retained values are not treated as a current finding."
    },
    {
      "signal_id": "stock-connect",
      "status": "live",
      "headline": "Southbound Stock Connect net flow is -1.316 billion Hong Kong dollars",
      "finding": "HKEX reports current southbound Stock Connect net flow of -1.316 billion Hong Kong dollars.",
      "metric": {
        "label": "southbound net flow",
        "value": -1.316,
        "unit": "HKD billions",
        "denominator": {
          "label": null,
          "value": null
        }
      },
      "source_timestamp": "2026-08-14T14:28:55Z",
      "story_url": "https://palimpsest.info/news/stock-connect/",
      "evidence_url": "https://palimpsest.info/readings/stock-connect-latest.json",
      "input_sha256": "659a35af203a31fafd2b5ccbac91f2678587dd6c3af9a2308cf110a49f6f03c6",
      "claim_fingerprint": "sha256:801115d66441cdfb3840e55ceea98ff654068e8faa062d6fe5fb296ade401c70",
      "method_summary": "See the complete embedded upstream payload and its raw feed",
      "method_version": 1,
      "relation": "topic-surface-only",
      "interpretation": "Current aggregate collector reading. It is relevant context only; the wire declares no timed, claim-specific verification join."
    }
  ],
  "limitations": [
    "Palimpsest retained feed title, canonical link, publication time, and a bounded excerpt; it did not fetch or semantically evaluate the article body.",
    "Independent-source counts describe publication structure, not the truth, completeness, or intent of the underlying claims.",
    "Collector links are predeclared topical surfaces, not a timed or claim-specific match to this event.",
    "A current collector value may post-date the article and cannot by itself establish cause, coordination, impact, verification, or refutation."
  ],
  "method": "Deterministic assessment of one validated newswire event against its independent-source structure and only the collector stories explicitly declared by that event. Collector joins remain topic-surface-only: no article body is fetched, no generative model is used, and no current measurement is represented as article-specific verification or causation."
}
