{
  "schema_version": "palimpsest-event-analysis.v1",
  "analysis_id": "analysisv-95028d6342f08d22c9f2e71a",
  "event_id": "event-b44318e680f1c6d273759ddd",
  "event_version_id": "eventv-92d396f00c83401031678717",
  "event_url": "https://palimpsest.info/news/wire/event-b44318e680f1c6d273759ddd/",
  "url": "https://palimpsest.info/news/wire/event-b44318e680f1c6d273759ddd/analysis.json",
  "generated_at": "2026-08-15T19:52:15Z",
  "disposition": "source-assessment",
  "scope_status": "in-scope",
  "position": "Palimpsest's view: this is a single attributed report, not an independently established fact.",
  "rationale": [
    "The dossier contains one independent source group. Palimpsest treats it as an attributed report, not independent corroboration.",
    "No Palimpsest collector surface is declared for this event, so the assessment stops at source structure and attribution."
  ],
  "evidence_assessment": {
    "strength": "single-source",
    "independent_groups": 1,
    "source_count": 1,
    "conclusion": "The dossier contains one independent source group. Palimpsest treats it as an attributed report, not independent corroboration."
  },
  "collector_context": [],
  "limitations": [
    "Palimpsest retained feed title, canonical link, publication time, and a bounded excerpt; it did not fetch or semantically evaluate the article body.",
    "Independent-source counts describe publication structure, not the truth, completeness, or intent of the underlying claims.",
    "No current Palimpsest measurement is used in this assessment."
  ],
  "method": "Deterministic assessment of one validated newswire event against its independent-source structure and only the collector stories explicitly declared by that event. Collector joins remain topic-surface-only: no article body is fetched, no generative model is used, and no current measurement is represented as article-specific verification or causation."
}
